{
  "$schema": "ops/schemas/lint-report.schema.json",
  "vault": ".",
  "generated_at": "2026-04-13T16:10:42Z",
  "artifact_kind": "wiki_lint_report",
  "producer": "ops.scripts.wiki_lint",
  "source_command": "python -m ops.scripts.wiki_lint",
  "source_revision": "unknown",
  "source_tree_fingerprint": "legacy_backfill_run_20260414_mechanism_planning_gate_baseline_lint",
  "input_fingerprints": {
    "policy": "legacy_backfill",
    "schema": "legacy_backfill",
    "artifact_envelope_schema": "legacy_backfill",
    "legacy_original_sha256": "07010e2b1d8110ae7351cf79e9420867dfdb6906b9af7b21c433af180ec36541"
  },
  "schema_version": 1,
  "artifact_status": "archived",
  "retention_policy": "archive",
  "encoding": "utf-8",
  "currentness": {
    "status": "current",
    "checked_at": "2026-04-13T16:10:42Z"
  },
  "policy": {
    "path": "ops/policies/wiki-maintainer-policy.yaml",
    "version": 3
  },
  "status": "pass",
  "errors": [],
  "warnings": [],
  "review_candidates": [
    {
      "type": "wiki_synthesis_multi_question_watch_candidate",
      "page": "wiki/synthesis--ai-execution-surface-and-runtime-efficiency-2026-04-13.md",
      "value": {
        "source_links": 6,
        "analysis_subsections": 6,
        "line_count": 100
      },
      "threshold": {
        "source_links": 5,
        "analysis_subsections": 5,
        "line_count": 55
      },
      "missing_boundary_sections": [],
      "supporting_pages": [
        "wiki/source--google-turboquant-kv-cache-compression-2026-04-13.md",
        "wiki/source--hbm-challengers-and-ai-memory-architecture-race-2026-04-13.md",
        "wiki/source--mit-attention-matching-kv-cache-compression-2026-04-13.md",
        "wiki/source--nvidia-marvell-ai-ran-strategy-2026-04-12.md",
        "wiki/source--nvidia-triattention-kv-cache-efficiency-2026-04-13.md",
        "wiki/source--turboquant-memory-savings-claim-calibration-2026-04-13.md"
      ],
      "reason": "wiki synthesis is broad enough to watch for future scope creep, but it already declares exclusion and future-ingest boundaries",
      "suggested_action": "watch_scope_boundary_and_future_ingest_routes",
      "advisory": {
        "boundary_sections_present": [
          "What this synthesis excludes",
          "Implications for future ingest"
        ],
        "exclusion_axes": [
          "누가 capacity와 procurement path를 잠그는가"
        ],
        "future_ingest_axes": [
          "edge/telecom execution surface",
          "runtime efficiency",
          "claim calibration",
          "architecture bypass",
          "network execution expansion",
          "runtime efficiency design",
          "runtime claim calibration",
          "quantization",
          "attention-preserving compression",
          "새 source가 execution surface 확장인지, compression design인지, claim calibration인지"
        ]
      }
    },
    {
      "type": "wiki_synthesis_multi_question_watch_candidate",
      "page": "wiki/synthesis--middle-east-shipping-and-energy-risk-2026-04-12.md",
      "value": {
        "source_links": 7,
        "analysis_subsections": 5,
        "line_count": 97
      },
      "threshold": {
        "source_links": 5,
        "analysis_subsections": 5,
        "line_count": 55
      },
      "missing_boundary_sections": [],
      "supporting_pages": [
        "wiki/source--hormuz-blockade-oil-over-100-and-global-macro-shock-2026-04-13.md",
        "wiki/source--hormuz-chokepoint-flows-and-bypass-capacity-2026-04-13.md",
        "wiki/source--hormuz-shipping-risk-outlook-2026-04-12.md",
        "wiki/source--korea-oil-supply-outlook-2026-04-12.md",
        "wiki/source--trump-hormuz-blockade-order-2026-04-12.md",
        "wiki/source--trump-oil-price-warning-and-iran-retaliation-2026-04-13.md",
        "wiki/source--us-iran-talks-pakistan-pullout-2026-04-12.md"
      ],
      "reason": "wiki synthesis is broad enough to watch for future scope creep, but it already declares exclusion and future-ingest boundaries",
      "suggested_action": "watch_scope_boundary_and_future_ingest_routes",
      "advisory": {
        "boundary_sections_present": [
          "What this synthesis excludes",
          "Implications for future ingest"
        ],
        "exclusion_axes": [
          "전쟁의 2차 투자 효과",
          "외교 -> 해운 심리 -> 에너지 가격 -> 조달 완충",
          "macro and market repricing"
        ],
        "future_ingest_axes": [
          "실물 해상/조달",
          "국내 거시 전이"
        ]
      }
    },
    {
      "type": "wiki_synthesis_multi_question_watch_candidate",
      "page": "wiki/synthesis--middle-east-war-macro-and-market-repricing-2026-04-13.md",
      "value": {
        "source_links": 10,
        "analysis_subsections": 6,
        "line_count": 108
      },
      "threshold": {
        "source_links": 5,
        "analysis_subsections": 5,
        "line_count": 55
      },
      "missing_boundary_sections": [],
      "supporting_pages": [
        "wiki/source--bank-of-korea-april-economic-assessment-2026-04-13.md",
        "wiki/source--bank-of-korea-rate-hold-and-middle-east-risk-2026-04-13.md",
        "wiki/source--china-central-bank-gold-buying-streak-2026-04-13.md",
        "wiki/source--dollar-safe-haven-bid-after-failed-us-iran-talks-2026-04-13.md",
        "wiki/source--emerging-market-outflows-after-iran-war-2026-04-13.md",
        "wiki/source--fed-war-risk-minutes-and-inflation-scenarios-2026-04-13.md",
        "wiki/source--gold-rebound-after-ceasefire-and-safe-haven-rotation-2026-04-13.md",
        "wiki/source--us-consumer-inflation-gasoline-shock-2026-04-13.md",
        "wiki/source--us-consumer-sentiment-record-low-amid-iran-war-2026-04-13.md",
        "wiki/source--won-dollar-near-1500-and-middle-east-fx-pressure-2026-04-13.md"
      ],
      "reason": "wiki synthesis is broad enough to watch for future scope creep, but it already declares exclusion and future-ingest boundaries",
      "suggested_action": "watch_scope_boundary_and_future_ingest_routes",
      "advisory": {
        "boundary_sections_present": [
          "What this synthesis excludes",
          "Implications for future ingest"
        ],
        "exclusion_axes": [
          "global market repricing",
          "macro policy"
        ],
        "future_ingest_axes": [
          "EM flow",
          "dollar",
          "inflation pass-through",
          "consumer expectations",
          "Fed scenario",
          "central-bank gold",
          "post-ceasefire precious-metals rotation",
          "physical disruption",
          "financial repricing"
        ]
      }
    }
  ],
  "stats": {
    "page_count": 145,
    "error_count": 0,
    "warning_count": 0,
    "review_candidate_count": 3
  }
}
